<?xml version="1.0" encoding="UTF-8" standalone="no"?>
<!DOCTYPE film SYSTEM "film.dtd">

<film>
    <title>Raiders of the Lost Ark</title>
    <casting>
        <director>
            <firstName>Steven</firstName>
            <lastName>Spielberg</lastName>
        </director>
        <actor>
            Harrison Ford
        </actor>
        <actor>
            Karen Allen
        </actor>
    </casting>
</film>
